{
    "name": "questionnaire-sample",
    "group": "Primärvård",
    "language": {
        "name": "Svenska",
        "code": "sv_SE"
    },
    "customCodes": [
        {
            "code": "DBNVNA05YNNNA1N000054",
            "vendor": "icquality"
        }
    ],
    "comments": [
        "Detta frågeformulär är ett exempel"
    ],
    "tags": [
        "ex"
    ],
    "questions": [
        {
            "text": "Skulle du: rekommendera hälso-/vårdcentralen till vänner och bekanta?",
            "explanation": "Var god skriv inom rutans ramar, texta tydligt.",
            "group": "Skulle du:",
            "part": "rekommendera hälso-/vårdcentralen till vänner och bekanta?",
            "elaboration": {
                "text": "Utveckla gärna ditt svar på sista sidan",
                "reference": "Har du andra synpunkter eller vill utveckla dina svar?"
            },
            "choices": [
                {
                    "value": "1",
                    "text": "Nej, inte alls"
                },
                {
                    "value": "2"
                },
                {
                    "value": "3"
                },
                {
                    "value": "4"
                },
                {
                    "value": "5",
                    "text": "Ja, helt och hållet"
                },
                {
                    "value": "6",
                    "text": "Ej aktuellt"
                }
            ],
            "module": {
                "name": "questionmodule-sample",
                "shortName": "qms",
                "question": {
                    "comparableText": "Skulle du rekommendera ${verksamheten} till vänner och bekanta?",
                    "dimension": "Delaktighet och involvering",
                    "choiceFreeText": false,
                    "choices": [
                        {
                            "value": "1",
                            "weight": -1
                        },
                        {
                            "value": "2",
                            "weight": -1
                        },
                        {
                            "value": "3",
                            "weight": 0
                        },
                        {
                            "value": "4",
                            "weight": 1
                        },
                        {
                            "value": "5",
                            "weight": 1
                        },
                        {
                            "value": "6"
                        }
                    ],
                    "customCodes": [
                        {
                            "code": "DBNVNA05YNNNA1N000054",
                            "vendor": "icquality"
                        }
                    ],
                    "comments": [
                        "Denna fråga är väldigt fin",
                        "Jag tycker om denna fråga"
                    ],
                    "tags": [
                        "ex"
                    ]
                }
            }
        },
        {
            "text": "Har du andra synpunkter eller vill utveckla dina svar?",
            "module": {
                "name": "questionmodule-sample",
                "shortName": "qms",
                "question": {
                    "comparableText": "Har du andra synpunkter eller vill utveckla dina svar?",
                    "choiceFreeText": true
                }
            }
        }
    ]
}